source,ID,Category,Question,Option A,Option B,Option C,Option D,Correct Answer
.kiro/specs/vortex-arena-map/nfl_trivia_500_questions.csv,33,Quarterbacks 2024,"Was Lamar Jackson the first QB to throw for 4,000+ yards and rush for 800+ yards?",Yes,No,He was tied with another QB,Not yet in 2024,Yes
.kiro/specs/vortex-arena-map/nfl_trivia_500_questions.csv,127,2024 Season Leaders,Did Brock Bowers set an NFL rookie record for receptions?,Yes,No,Tied,Almost,Yes
.kiro/specs/vortex-arena-map/nfl_trivia_500_questions.csv,138,Defensive Players 2024,Did Jared Verse finish in the top 5 for defensive rookie of the year voting?,Yes,No,He won it,Close,Yes
.kiro/specs/vortex-arena-map/nfl_trivia_500_questions.csv,159,Team Records & Standings,Did all playoff teams in 2024 win at least 10 games?,Yes,No,Some,One didn't,Yes
.kiro/specs/vortex-arena-map/nfl_trivia_500_questions.csv,183,Team Achievements 2024,Did the Los Angeles Rams and Chargers both qualify for the 2024 playoffs?,Yes,No,One did,Barely,Yes
.kiro/specs/vortex-arena-map/nfl_trivia_500_questions.csv,185,Team Achievements 2024,Did the Detroit Lions make the playoffs in 2024?,Yes,No,Wild card,As 4 seed,Yes
.kiro/specs/vortex-arena-map/nfl_trivia_500_questions.csv,186,Team Achievements 2024,Did the Detroit Lions win their first playoff game since 1991?,Yes,No,In 2023,Close but no,Yes
.kiro/specs/vortex-arena-map/nfl_trivia_500_questions.csv,187,Team Achievements 2024,Did the #7 seed Packers beat the #2 seed Cowboys in the 2023 playoffs?,Yes,No,Lost in other round,In Super Bowl,Yes
.kiro/specs/vortex-arena-map/nfl_trivia_500_questions.csv,188,Team Achievements 2024,Was this the first time a #7 seed won a playoff game since 2020?,Yes,No,No seeds then,2020 was first,Yes
.kiro/specs/vortex-arena-map/nfl_trivia_500_questions.csv,198,Historical Comparisons,Is Patrick Mahomes currently active in the NFL?,Yes,No,Recently retired,Considering,Yes
.kiro/specs/vortex-arena-map/nfl_trivia_500_questions.csv,199,Historical Comparisons,Did Mahomes lose Super Bowl LIX?,Yes,No,Won,Didn't play,Yes
.kiro/specs/vortex-arena-map/nfl_trivia_500_questions.csv,221,Recent Player Transactions,Did Davante Adams get traded in 2024?,Yes,No,Pending,Rumored,Yes
.kiro/specs/vortex-arena-map/nfl_trivia_500_questions.csv,224,Recent Player Transactions,Did the Eagles acquire any cornerbacks in the 2024 draft?,Yes,No,Two,Traded for,Yes
.kiro/specs/vortex-arena-map/nfl_trivia_500_questions.csv,225,Recent Player Transactions,Did Xavier Worthy perform well in his rookie season with the Chiefs?,Yes,No,Decent,Struggled,Yes
.kiro/specs/vortex-arena-map/nfl_trivia_500_questions.csv,227,Recent Player Transactions,Did Braden Fiske have a strong rookie season in 2024?,Yes,No,Decent,Struggled,Yes
.kiro/specs/vortex-arena-map/nfl_trivia_500_questions.csv,229,Recent Player Transactions,Did any cornerbacks from the Eagles 2024 draft class perform well?,Yes,No,One did,Too early,Yes
.kiro/specs/vortex-arena-map/nfl_trivia_500_questions.csv,249,Advanced Statistics,Did Jayden Daniels rank in the top 6 for Turnovers Worthy Play rate?,Yes,No,Tied,Just missed,Yes
.kiro/specs/vortex-arena-map/nfl_trivia_500_questions.csv,258,Game Statistics,Did Milton Williams cause a fumble in Super Bowl LIX?,Yes,No,Strip sack,Safety,Yes
.kiro/specs/vortex-arena-map/nfl_trivia_500_questions.csv,259,Game Statistics,Did the Eagles defense blitz at all in Super Bowl LIX?,No,Yes,Once,Multiple times,No
.kiro/specs/vortex-arena-map/nfl_trivia_500_questions.csv,261,Team Victories & Streaks,Did the Eagles have the longest win streak in 2024?,Yes,No,Tied,Close,Yes
.kiro/specs/vortex-arena-map/nfl_trivia_500_questions.csv,264,Team Victories & Streaks,Did the Kansas City Chiefs have a long winning streak in 2024?,Yes,No,Moderate,Brief,Yes
.kiro/specs/vortex-arena-map/nfl_trivia_500_questions.csv,266,Team Victories & Streaks,Did all division winners have at least 10 wins in 2024?,Yes,No,Most did,None,Yes
.kiro/specs/vortex-arena-map/nfl_trivia_500_questions.csv,267,Team Victories & Streaks,Did the 2024 NFL season have more upsets than normal?,No,Yes,About average,Fewer,No
.kiro/specs/vortex-arena-map/nfl_trivia_500_questions.csv,269,Team Victories & Streaks,Did the Vikings have a strong 2024 season?,Yes,No,Decent,Poor,Yes
.kiro/specs/vortex-arena-map/nfl_trivia_500_questions.csv,270,Team Victories & Streaks,Did the Detroit Lions' #1 seed help them in playoffs?,No,Yes,Didn't matter,Too early,No
.kiro/specs/vortex-arena-map/nfl_trivia_500_questions.csv,276,Player Contracts & Deals,Did D.J. Reed sign a big contract in 2025?,Yes,No,Moderate,Franchise,Yes
.kiro/specs/vortex-arena-map/nfl_trivia_500_questions.csv,279,Player Contracts & Deals,Did Mekhi Becton sign with any AFC team in 2025?,Yes,No,Jets,Free,Yes
.kiro/specs/vortex-arena-map/nfl_trivia_500_questions.csv,281,Notable Performances,Did Derrick Henry have a good first season with his new team?,Yes,No,Average,Injured,Yes
.kiro/specs/vortex-arena-map/nfl_trivia_500_questions.csv,282,Notable Performances,Did Marvin Harrison Jr. have a strong rookie season?,Yes,No,Decent,Injured,Yes
.kiro/specs/vortex-arena-map/nfl_trivia_500_questions.csv,285,Notable Performances,Did Brian Thomas Jr. have a strong rookie season?,Yes,No,Decent,Injured,Yes
.kiro/specs/vortex-arena-map/nfl_trivia_500_questions.csv,289,Notable Performances,Was Shedeur Sanders drafted in the first round in 2025?,No,Yes,Pending,Undrafted,No
.kiro/specs/vortex-arena-map/nfl_trivia_500_questions.csv,290,Notable Performances,Did the 49ers have any rookie WR perform well in 2024?,Yes,No,Injured,Average,Yes
.kiro/specs/vortex-arena-map/nfl_trivia_500_questions.csv,293,Coaching Performance,Did Sean Payton coach the Eagles in 2024?,No,Yes,Retired,Interim,No
.kiro/specs/vortex-arena-map/nfl_trivia_500_questions.csv,295,Coaching Performance,Did the Lions have a new head coach in 2024?,No,Yes,Interim,Recently,No
.kiro/specs/vortex-arena-map/nfl_trivia_500_questions.csv,297,Coaching Performance,Did Dan Campbell take a new job in 2025?,No,Yes,Interim,Recently,No
.kiro/specs/vortex-arena-map/nfl_trivia_500_questions.csv,298,Coaching Performance,Did the Ravens have issues with playoff success in 2024?,Yes,No,Mixed,New coach,Yes
.kiro/specs/vortex-arena-map/nfl_trivia_500_questions.csv,301,Offensive Weapons,Does Josh Allen have adequate receiving weapons?,Yes,No,Some,Getting better,Yes
.kiro/specs/vortex-arena-map/nfl_trivia_500_questions.csv,304,Offensive Weapons,Did the Bills have good offensive coaching in 2024?,Yes,No,Average,Poor,Yes
.kiro/specs/vortex-arena-map/nfl_trivia_500_questions.csv,305,Offensive Weapons,Does Patrick Mahomes have great receiving weapons?,Yes,No,Some,Lost some,Yes
.kiro/specs/vortex-arena-map/nfl_trivia_500_questions.csv,307,Offensive Weapons,Does Lamar Jackson have great receiving options?,Yes,No,Some,Limited,Yes
.kiro/specs/vortex-arena-map/nfl_trivia_500_questions.csv,309,Offensive Weapons,Does Jalen Hurts have elite receiving weapons?,Yes,No,Some,Recently added,Yes
.kiro/specs/vortex-arena-map/nfl_trivia_500_questions.csv,313,Defensive Excellence,Did the Eagles defense blitz in Super Bowl LIX?,No,Yes,Limited,Few times,No
.kiro/specs/vortex-arena-map/nfl_trivia_500_questions.csv,315,Defensive Excellence,Did the Eagles force turnovers in Super Bowl LIX?,Yes,No,One,None,Yes
.kiro/specs/vortex-arena-map/nfl_trivia_500_questions.csv,320,Defensive Excellence,Did the Eagles' secondary perform well in 2024?,Yes,No,Average,Mixed,Yes
.kiro/specs/vortex-arena-map/nfl_trivia_500_questions.csv,321,Individual Records & Milestones,Did Saquon Barkley break any team records in 2024?,Yes,No,Multiple,Franchise,Yes
.kiro/specs/vortex-arena-map/nfl_trivia_500_questions.csv,322,Individual Records & Milestones,Did Saquon Barkley come close to the NFL single-season rushing record?,Yes,No,100 yards away,Close,Yes
.kiro/specs/vortex-arena-map/nfl_trivia_500_questions.csv,325,Individual Records & Milestones,Did Brock Bowers set the all-time rookie receptions record?,Yes,No,Tied,Almost,Yes
.kiro/specs/vortex-arena-map/nfl_trivia_500_questions.csv,328,Individual Records & Milestones,Did Jayden Daniels have a historic rookie season?,Yes,No,Good,Average,Yes
.kiro/specs/vortex-arena-map/nfl_trivia_500_questions.csv,330,Individual Records & Milestones,Is Jayden Daniels a future Hall of Famer?,Possible,No,Too early,Likely,Possible
.kiro/specs/vortex-arena-map/nfl_trivia_500_questions.csv,331,Fan Favorites & Highlights,Did Cooper DeJean have a memorable moment in Super Bowl LIX?,Yes,No,Fumble recovery,Sack,Yes
.kiro/specs/vortex-arena-map/nfl_trivia_500_questions.csv,333,Fan Favorites & Highlights,Was it Cooper DeJean's 22nd birthday?,Yes,No,21st,23rd,Yes
.kiro/specs/vortex-arena-map/nfl_trivia_500_questions.csv,335,Fan Favorites & Highlights,Did DeVonta Smith score in Super Bowl LIX?,Yes,No,Multiple,One,Yes
.kiro/specs/vortex-arena-map/nfl_trivia_500_questions.csv,338,Fan Favorites & Highlights,Did DeVonta Smith have a good 2024 season?,Yes,No,Average,Injured,Yes
.kiro/specs/vortex-arena-map/nfl_trivia_500_questions.csv,339,Fan Favorites & Highlights,Did A.J. Brown have a great 2024 season?,Yes,No,Average,Injured,Yes
.kiro/specs/vortex-arena-map/nfl_trivia_500_questions.csv,340,Fan Favorites & Highlights,Did the Eagles have a dominant passing game in 2024?,Yes,No,Average,Mixed,Yes
.kiro/specs/vortex-arena-map/nfl_trivia_500_questions.csv,351,2025 Offseason Moves,Did the Eagles hire a new head coach in 2025?,No,Yes,Promoted interim,From outside,No
.kiro/specs/vortex-arena-map/nfl_trivia_500_questions.csv,352,2025 Offseason Moves,Did the Chiefs make major roster changes in 2025?,No,Yes,Some,Minor,No
.kiro/specs/vortex-arena-map/nfl_trivia_500_questions.csv,353,2025 Offseason Moves,Did the Bills make significant trades in 2025?,No,Yes,Some,Pending,No
.kiro/specs/vortex-arena-map/nfl_trivia_500_questions.csv,354,2025 Offseason Moves,Did the Ravens make significant roster changes?,Yes,No,Some,Pending,Yes
.kiro/specs/vortex-arena-map/nfl_trivia_500_questions.csv,355,2025 Offseason Moves,Did the Lions make any significant acquisitions?,No,Yes,Some,Pending,No
.kiro/specs/vortex-arena-map/nfl_trivia_500_questions.csv,356,2025 Offseason Moves,Did the Vikings make any significant roster moves?,No,Yes,Some,Pending,No
.kiro/specs/vortex-arena-map/nfl_trivia_500_questions.csv,357,2025 Offseason Moves,Did the Chargers hire Jim Harbaugh in 2024?,Yes,No,2023,Pending,Yes
.kiro/specs/vortex-arena-map/nfl_trivia_500_questions.csv,375,Conference Standings,Did any division have all teams above .500?,No,Yes,Some,One,No
.kiro/specs/vortex-arena-map/nfl_trivia_500_questions.csv,377,Conference Standings,Did the AFC South have a weak 2024 season?,Yes,No,Average,Mixed,Yes
.kiro/specs/vortex-arena-map/nfl_trivia_500_questions.csv,379,Conference Standings,Did the NFC South have any dominant teams?,No,Yes,One,Emerging,No
.kiro/specs/vortex-arena-map/nfl_trivia_500_questions.csv,381,Special Teams & Other Stats,Did Saquon Barkley set the combined regular season + postseason rushing record?,Close,Yes,No,Almost,Close
.kiro/specs/vortex-arena-map/nfl_trivia_500_questions.csv,385,Special Teams & Other Stats,Did the Eagles rest starters in their final regular season game?,Yes,No,Some,Partial,Yes
.kiro/specs/vortex-arena-map/nfl_trivia_500_questions.csv,387,Special Teams & Other Stats,Did Eric Dickerson break his record recently?,No,Yes,1984,Still stands,No
.kiro/specs/vortex-arena-map/nfl_trivia_500_questions.csv,393,Trivia & Fun Facts,Did Joe Namath and Joe Montana both win Super Bowls?,Yes,No,One did,Different eras,Yes
.kiro/specs/vortex-arena-map/nfl_trivia_500_questions.csv,395,Trivia & Fun Facts,Did Jalen Hurts become only the 3rd starting QB to win both a championship and Super Bowl?,Yes,No,Almost,2nd,Yes
.kiro/specs/vortex-arena-map/nfl_trivia_500_questions.csv,397,Trivia & Fun Facts,Did Jalen Hurts play in college?,Yes,No,Briefly,High school only,Yes
.kiro/specs/vortex-arena-map/nfl_trivia_500_questions.csv,399,Trivia & Fun Facts,Did Jalen Hurts win a national championship in college?,No,Yes,Made final four,Close,No
.kiro/specs/vortex-arena-map/nfl_trivia_500_questions.csv,403,Notable Draft Picks,Did Caleb Williams win the Heisman Trophy?,Yes,No,Multiple times,Finalist,Yes
.kiro/specs/vortex-arena-map/nfl_trivia_500_questions.csv,406,Notable Draft Picks,Did Drake Maye attend UNC?,Yes,No,Harvard,Yale,Yes
.kiro/specs/vortex-arena-map/nfl_trivia_500_questions.csv,407,Notable Draft Picks,Was Drake Maye a successful Patriots draft pick?,Developing,No,Yes,Too early,Developing
.kiro/specs/vortex-arena-map/nfl_trivia_500_questions.csv,409,Notable Draft Picks,Did Michael Penix Jr. sign with the Falcons?,Yes,Cardinals,Colts,Jaguars,Colts
.kiro/specs/vortex-arena-map/nfl_trivia_500_questions.csv,416,Statistical Leaders Continued,Did any defensive back win MVP in recent years?,No,Yes,Not since 1980s,Pending,No
.kiro/specs/vortex-arena-map/nfl_trivia_500_questions.csv,417,Statistical Leaders Continued,Did any linebacker win MVP in recent years?,No,Yes,Not since 2000s,Pending,No
.kiro/specs/vortex-arena-map/nfl_trivia_500_questions.csv,421,Playoff Seeding Analysis,Did the #1 seed in the AFC have an easy path to the Super Bowl?,No,Yes,Average,Moderate,No
.kiro/specs/vortex-arena-map/nfl_trivia_500_questions.csv,422,Playoff Seeding Analysis,Did the #1 seed in the NFC make it to the Super Bowl?,No,Yes,Lost earlier,Barely,No
.kiro/specs/vortex-arena-map/nfl_trivia_500_questions.csv,424,Playoff Seeding Analysis,Was the Lions' loss a major upset?,No,Yes,Unexpected,Surprising,No
.kiro/specs/vortex-arena-map/nfl_trivia_500_questions.csv,425,Playoff Seeding Analysis,Did the Chiefs make the Super Bowl as the #1 seed?,Yes,No,From wild card,From 3 seed,Yes
.kiro/specs/vortex-arena-map/nfl_trivia_500_questions.csv,426,Playoff Seeding Analysis,Did the Eagles make the Super Bowl as the #2 seed?,Yes,No,From wild card,From 5 seed,Yes
.kiro/specs/vortex-arena-map/nfl_trivia_500_questions.csv,427,Playoff Seeding Analysis,Has a #2 seed ever made the Super Bowl?,Yes,No,Rarely,Once,Yes
.kiro/specs/vortex-arena-map/nfl_trivia_500_questions.csv,428,Playoff Seeding Analysis,Did the Bills have a favorable playoff path?,No,Yes,Average,Tough,No
.kiro/specs/vortex-arena-map/nfl_trivia_500_questions.csv,431,Injury & Health Updates,Were there any major injuries during Super Bowl LIX?,No,Yes,Minor,Some,No
.kiro/specs/vortex-arena-map/nfl_trivia_500_questions.csv,432,Injury & Health Updates,Did Patrick Mahomes have any injuries in 2024?,Yes,No,Minor,Recovery,Yes
.kiro/specs/vortex-arena-map/nfl_trivia_500_questions.csv,433,Injury & Health Updates,Did Josh Allen have any injuries in 2024?,No,Yes,Minor,Shoulder,No
.kiro/specs/vortex-arena-map/nfl_trivia_500_questions.csv,434,Injury & Health Updates,Did Lamar Jackson have any injuries in 2024?,No,Yes,Minor,Knee,No
.kiro/specs/vortex-arena-map/nfl_trivia_500_questions.csv,435,Injury & Health Updates,Did Jalen Hurts have any injuries in 2024?,No,Yes,Minor,Shoulder,No
.kiro/specs/vortex-arena-map/nfl_trivia_500_questions.csv,436,Injury & Health Updates,Did Saquon Barkley have any injuries in 2024?,No,Yes,Minor,Ankle,No
.kiro/specs/vortex-arena-map/nfl_trivia_500_questions.csv,437,Injury & Health Updates,Did the Eagles have a healthy roster in 2024?,Yes,No,Mostly,Some issues,Yes
.kiro/specs/vortex-arena-map/nfl_trivia_500_questions.csv,438,Injury & Health Updates,Did the Chiefs have health issues in 2024?,Yes,No,Minor,Some,Yes
.kiro/specs/vortex-arena-map/nfl_trivia_500_questions.csv,439,Injury & Health Updates,Did the Lions have major injuries in 2024?,Yes,No,Some,Minor,Yes
.kiro/specs/vortex-arena-map/nfl_trivia_500_questions.csv,441,Fan Voting & Selections,Did Josh Allen win the Pro Bowl vote in 2024?,Yes,No,Tied,Did not vote,Yes
.kiro/specs/vortex-arena-map/nfl_trivia_500_questions.csv,442,Fan Voting & Selections,Did Patrick Mahomes make the Pro Bowl in 2024?,Yes,No,Alternate,Did not vote,Yes
.kiro/specs/vortex-arena-map/nfl_trivia_500_questions.csv,443,Fan Voting & Selections,Did Lamar Jackson make the Pro Bowl in 2024?,Yes,No,Alternate,Did not vote,Yes
.kiro/specs/vortex-arena-map/nfl_trivia_500_questions.csv,444,Fan Voting & Selections,Did Saquon Barkley make the Pro Bowl in 2024?,Yes,No,Alternate,Did not vote,Yes
.kiro/specs/vortex-arena-map/nfl_trivia_500_questions.csv,445,Fan Voting & Selections,Did Travis Kelce make the Pro Bowl in 2024?,Yes,No,Alternate,Did not vote,Yes
.kiro/specs/vortex-arena-map/nfl_trivia_500_questions.csv,446,Fan Voting & Selections,Did Tyreek Hill make the Pro Bowl in 2024?,Yes,No,Alternate,Did not vote,Yes
.kiro/specs/vortex-arena-map/nfl_trivia_500_questions.csv,447,Fan Voting & Selections,Did CeeDee Lamb make the Pro Bowl in 2024?,Yes,No,Alternate,Did not vote,Yes
.kiro/specs/vortex-arena-map/nfl_trivia_500_questions.csv,448,Fan Voting & Selections,Did Patrick Surtain II make the Pro Bowl in 2024?,Yes,No,Alternate,Did not vote,Yes
.kiro/specs/vortex-arena-map/nfl_trivia_500_questions.csv,449,Fan Voting & Selections,Did Trey Hendrickson make the Pro Bowl in 2024?,Yes,No,Alternate,Did not vote,Yes
.kiro/specs/vortex-arena-map/nfl_trivia_500_questions.csv,450,Fan Voting & Selections,Did the Eagles have multiple Pro Bowlers?,Yes,No,Some,Few,Yes
.kiro/specs/vortex-arena-map/nfl_trivia_500_questions.csv,451,Franchise Records & Milestones,Did the Eagles win their second Super Bowl in franchise history?,Yes,No,First,Third,Yes
.kiro/specs/vortex-arena-map/nfl_trivia_500_questions.csv,455,Franchise Records & Milestones,Did the Eagles make the Super Bowl in 2017?,Yes,No,Lost earlier,Alternate,Yes
.kiro/specs/vortex-arena-map/nfl_trivia_500_questions.csv,460,Franchise Records & Milestones,Have the Eagles had success in recent years?,Yes,No,Mixed,Inconsistent,Yes
.kiro/specs/vortex-arena-map/nfl_trivia_500_questions.csv,462,Competitive Balance,Did any division have two teams with 12+ wins?,Yes,No,One division,Multiple,Yes
.kiro/specs/vortex-arena-map/nfl_trivia_500_questions.csv,463,Competitive Balance,Did any division have all playoff-quality teams?,No,Yes,One did,NFC North,No
.kiro/specs/vortex-arena-map/nfl_trivia_500_questions.csv,464,Competitive Balance,Was 2024 a competitive NFL season?,Yes,No,Somewhat,Very much,Yes
.kiro/specs/vortex-arena-map/nfl_trivia_500_questions.csv,465,Competitive Balance,Did the playoff bracket have major surprises?,No,Yes,Some,Few,No
.kiro/specs/vortex-arena-map/nfl_trivia_500_questions.csv,466,Competitive Balance,Was the Super Bowl matchup expected?,Yes,No,Somewhat,Partially,Yes
.kiro/specs/vortex-arena-map/nfl_trivia_500_questions.csv,467,Competitive Balance,Did any playoff team exceed expectations?,Yes,No,Few,One,Yes
.kiro/specs/vortex-arena-map/nfl_trivia_500_questions.csv,468,Competitive Balance,Did any playoff team underperform?,Yes,No,Few,One,Yes
.kiro/specs/vortex-arena-map/nfl_trivia_500_questions.csv,469,Competitive Balance,Was there competitive parity in 2024?,Yes,No,Some,Limited,Yes
.kiro/specs/vortex-arena-map/nfl_trivia_500_questions.csv,474,Media & Broadcasting,Does ESPN have exclusive Monday Night Football?,Yes,No,Shares,Partial,Yes
.kiro/specs/vortex-arena-map/nfl_trivia_500_questions.csv,476,Media & Broadcasting,Do streaming services carry NFL games?,Yes,No,Some,Limited,Yes
.kiro/specs/vortex-arena-map/nfl_trivia_500_questions.csv,478,Media & Broadcasting,Did the 2024 NFL season have strong viewership?,Yes,No,Average,Declining,Yes
.kiro/specs/vortex-arena-map/nfl_trivia_500_questions.csv,479,Media & Broadcasting,Are Super Bowls always the most-watched sporting event in the US?,Usually,No,Sometimes,Always,Usually
.kiro/specs/vortex-arena-map/nfl_trivia_500_questions.csv,480,Media & Broadcasting,Will the Eagles-Chiefs Super Bowl have lasting impact?,Yes,No,Some,Minimal,Yes
.kiro/specs/vortex-arena-map/nfl_trivia_500_questions.csv,481,Rule Changes & Officiating,Were there any major rule changes in 2024?,No,Yes,Some minor,Pending,No
.kiro/specs/vortex-arena-map/nfl_trivia_500_questions.csv,483,Rule Changes & Officiating,Is pass interference still a reviewable call?,Limited,Yes,No,Rarely,Limited
.kiro/specs/vortex-arena-map/nfl_trivia_500_questions.csv,484,Rule Changes & Officiating,Can defensive pass interference be challenged?,No,Yes,Limited,On offense,Limited
.kiro/specs/vortex-arena-map/nfl_trivia_500_questions.csv,485,Rule Changes & Officiating,Are there kickoff rule changes?,Yes,No,Recently changed,Under review,Yes
.kiro/specs/vortex-arena-map/nfl_trivia_500_questions.csv,489,Rule Changes & Officiating,Is the NFL considering playoff expansion?,No,Yes,Under review,Pending,No
.kiro/specs/vortex-arena-map/nfl_trivia_500_questions.csv,491,Youth & Rookie Development,Did any 2024 rookie win major awards besides Daniels?,Yes,No,Verse did,Bowers near,Yes
.kiro/specs/vortex-arena-map/nfl_trivia_500_questions.csv,494,Youth & Rookie Development,Did any 2024 QB recruit become an immediate starter?,Yes,No,Some,All,Yes
.kiro/specs/vortex-arena-map/nfl_trivia_500_questions.csv,499,Youth & Rookie Development,Do rookies have more impact now than historically?,Yes,No,Same,Less,Yes
.kiro/specs/vortex-arena-map/nfl_trivia_500_questions_part2.csv,505,Super Bowl LIV 2020,Did the Chiefs overcome a deficit in Super Bowl LIV?,Yes,No,Led entire game,Never trailed,Yes
.kiro/specs/vortex-arena-map/nfl_trivia_500_questions_part2.csv,510,Super Bowl LIV 2020,Did Patrick Mahomes become the youngest to win both MVP and Super Bowl?,Yes,No,Tied record,Close,Yes
.kiro/specs/vortex-arena-map/nfl_trivia_500_questions_part2.csv,518,Super Bowl LV 2021,Did Tom Brady play for the Buccaneers in 2020?,Yes,No,Starting 2021,Mid-season,Yes
.kiro/specs/vortex-arena-map/nfl_trivia_500_questions_part2.csv,520,Super Bowl LV 2021,Was this the first time a team won at home?,No,Yes,Second time,Rare,No
.kiro/specs/vortex-arena-map/nfl_trivia_500_questions_part2.csv,525,Super Bowl LVI 2022,Did the Rams win at their home stadium?,Yes,No,Neutral site,In Cincinnati,Yes
.kiro/specs/vortex-arena-map/nfl_trivia_500_questions_part2.csv,529,Super Bowl LVI 2022,Did Matthew Stafford get his first Super Bowl win?,Yes,No,Second,Third,Yes
.kiro/specs/vortex-arena-map/nfl_trivia_500_questions_part2.csv,536,Super Bowl LVII 2023,Did the Chiefs win back-to-back Super Bowls?,Yes,No,2 straight wins,3 straight wins,Yes
.kiro/specs/vortex-arena-map/nfl_trivia_500_questions_part2.csv,542,Super Bowl LVIII 2024,Did Super Bowl LVIII go to overtime?,Yes,No,Double OT,Triple OT,Yes
.kiro/specs/vortex-arena-map/nfl_trivia_500_questions_part2.csv,546,Super Bowl LVIII 2024,Did this make the Chiefs the first back-to-back since 2004?,Yes,No,Third in a row,First ever,Yes
.kiro/specs/vortex-arena-map/nfl_trivia_500_questions_part2.csv,549,Super Bowl LVIII 2024,Did Christian McCaffrey score in Super Bowl LVIII?,Yes,No,Multiple,One TD,Yes
.kiro/specs/vortex-arena-map/nfl_trivia_500_questions_part2.csv,558,2020 NFL Season,Is 121.5 the second-highest passer rating in NFL history?,Yes,No,Tied,Not even top 5,Yes
.kiro/specs/vortex-arena-map/nfl_trivia_500_questions_part2.csv,560,2020 NFL Season,Did the Packers win the NFC North in 2020?,Yes,No,Wild card,Missed playoffs,Yes
.kiro/specs/vortex-arena-map/nfl_trivia_500_questions_part2.csv,561,2021 NFL Season,Did Tom Brady win the MVP in 2021?,No,Yes,Shared,Runner-up,No
.kiro/specs/vortex-arena-map/nfl_trivia_500_questions_part2.csv,564,2021 NFL Season,Did Tom Brady throw for 40+ touchdowns in 2021?,Yes,No,Exactly 40,39,Yes
.kiro/specs/vortex-arena-map/nfl_trivia_500_questions_part2.csv,567,2021 NFL Season,Did Tom Brady play in his first Super Bowl with Tampa Bay?,Yes,No,Not yet,Already won,No
.kiro/specs/vortex-arena-map/nfl_trivia_500_questions_part2.csv,568,2021 NFL Season,Did Tom Brady break any records in 2021?,Yes,No,Several,One or two,Yes
.kiro/specs/vortex-arena-map/nfl_trivia_500_questions_part2.csv,576,2022 NFL Season,Was 2022 Patrick Mahomes' second MVP?,Yes,No,Third,First,Yes
.kiro/specs/vortex-arena-map/nfl_trivia_500_questions_part2.csv,577,2022 NFL Season,Did Patrick Mahomes win a Super Bowl MVP in 2022?,Yes,No,Not yet,Later won,Yes
.kiro/specs/vortex-arena-map/nfl_trivia_500_questions_part2.csv,580,2022 NFL Season,Did the Chiefs make it to Super Bowl LVI after 2022?,No,Yes,Lost earlier,Missed playoffs,No
.kiro/specs/vortex-arena-map/nfl_trivia_500_questions_part2.csv,587,2023 NFL Season MVP,Was 2023 Lamar Jackson's first unanimous MVP?,No,Yes,Nearly unanimous,Second unanimous,No
.kiro/specs/vortex-arena-map/nfl_trivia_500_questions_part2.csv,589,2023 NFL Season MVP,Did Lamar Jackson win unanimously in 2019?,Yes,No,Close,Tied,Yes
.kiro/specs/vortex-arena-map/nfl_trivia_500_questions_part2.csv,595,2023 Season Awards,Did Christian McCaffrey have 17 consecutive games with a touchdown?,Yes,No,19 games,15 games,Yes
.kiro/specs/vortex-arena-map/nfl_trivia_500_questions_part2.csv,599,2023 Season Awards,Did Christian McCaffrey finish in top 5 MVP voting?,Yes,No,Third place,Second place,Yes
.kiro/specs/vortex-arena-map/nfl_trivia_500_questions_part2.csv,606,Tom Brady Career Stats,Did Tom Brady unretire?,Yes,No,Partially,Briefly,Yes
.kiro/specs/vortex-arena-map/nfl_trivia_500_questions_part2.csv,617,Patrick Mahomes Career,Did Patrick Mahomes play baseball in college?,Yes,No,Minor league,Briefly,Yes
.kiro/specs/vortex-arena-map/nfl_trivia_500_questions_part2.csv,620,Patrick Mahomes Career,Is Patrick Mahomes a first-team All-Pro?,Yes,No,Multiple times,Once,Yes
.kiro/specs/vortex-arena-map/nfl_trivia_500_questions_part2.csv,624,Lamar Jackson Career,Did Lamar Jackson win the Heisman Trophy?,Yes,No,Runner-up,Not eligible,Yes
.kiro/specs/vortex-arena-map/nfl_trivia_500_questions_part2.csv,628,Lamar Jackson Career,Is Lamar Jackson known as a dual-threat QB?,Yes,No,Mostly passer,Mostly rusher,Yes
