ID,Category,Question,Option A,Option B,Option C,Option D,Correct Answer
586,Injury-Impacted Seasons,Which player Godwin return from injury?,Chris Godwin,Dak Prescott,Patrick Surtain II,Joe Burrow,Chris Godwin
587,Injury-Impacted Seasons,Which player Gronkowski recover from injury?,Rob Gronkowski,Dak Prescott,Patrick Surtain II,Travis Kelce,Rob Gronkowski
588,Injury-Impacted Seasons,Which player Watson miss games?,Deshaun Watson,Dak Prescott,Patrick Surtain II,Travis Kelce,Deshaun Watson
589,Injury-Impacted Seasons,Which player Tagovailoa have injury issues?,Tua Tagovailoa,Dak Prescott,Patrick Surtain II,Joe Burrow,Tua Tagovailoa
590,Injury-Impacted Seasons,Which player Mahomes play most games?,Patrick Mahomes,Dak Prescott,Patrick Surtain II,Joe Burrow,Patrick Mahomes
591,Notable Transactions & Signings,Which player Brown play for Tampa Bay?,Antonio Brown,Dak Prescott,Patrick Surtain II,Travis Kelce,Antonio Brown
592,Notable Transactions & Signings,Which player signed with the Buccaneers?,Leonard Fournette,Dak Prescott,Patrick Surtain II,Joe Burrow,Leonard Fournette
593,Notable Transactions & Signings,Which player Fournette score in the Super Bowl?,Leonard Fournette,Dak Prescott,Patrick Surtain II,Travis Kelce,Leonard Fournette
594,Notable Transactions & Signings,Which player Stidham play for the Patriots?,Jarrett Stidham,Dak Prescott,Patrick Surtain II,Joe Burrow,Jarrett Stidham
