ID,Category,Question,Option A,Option B,Option C,Option D,Correct Answer
1,Recent Playoffs & Super Bowls,What was the final score of Super Bowl LIX?,"Philadelphia Eagles 40, Kansas City Chiefs 22","Philadelphia Eagles 35, Kansas City Chiefs 20","Philadelphia Eagles 42, Kansas City Chiefs 24","Philadelphia Eagles 38, Kansas City Chiefs 25","Philadelphia Eagles 40, Kansas City Chiefs 22"
2,Recent Playoffs & Super Bowls,Who was named Super Bowl LIX MVP?,Jalen Hurts,DeVonta Smith,Saquon Barkley,A.J. Brown,Jalen Hurts
3,Recent Playoffs & Super Bowls,In what city was Super Bowl LIX played?,New Orleans,Miami,Las Vegas,Tampa,New Orleans
4,Recent Playoffs & Super Bowls,What was the halftime score in Super Bowl LIX?,"Eagles 24, Chiefs 0","Eagles 21, Chiefs 3","Eagles 20, Chiefs 7","Eagles 17, Chiefs 10","Eagles 24, Chiefs 0"
5,Recent Playoffs & Super Bowls,Which team won Super Bowl LVIII (2023 season)?,Kansas City Chiefs,San Francisco 49ers,Philadelphia Eagles,Detroit Lions,Kansas City Chiefs
6,Recent Playoffs & Super Bowls,Who threw the game-winning touchdown in Super Bowl LVIII?,Patrick Mahomes,Joe Burrow,Josh Allen,Jalen Hurts,Patrick Mahomes
7,Recent Playoffs & Super Bowls,Which Eagles cornerback returned an interception for a touchdown in Super Bowl LIX?,Cooper DeJean,Quinyon Mitchell,James Bradberry,Darius Slay,Cooper DeJean
8,Recent Playoffs & Super Bowls,Who was the Philadelphia Eagles head coach that won Super Bowl LIX?,Jonathan Gannon,Nick Sirianni,Doug Pederson,Chip Kelly,Jonathan Gannon
9,2024 NFL Season Awards,Who won the 2024 NFL MVP award?,Josh Allen,Lamar Jackson,Patrick Mahomes,Jalen Hurts,Josh Allen
10,2024 NFL Season Awards,Who won the 2024 Offensive Player of the Year award?,Saquon Barkley,Lamar Jackson,Derrick Henry,Travis Kelce,Saquon Barkley
11,2024 NFL Season Awards,Who won the 2024 Defensive Player of the Year award?,Patrick Surtain II,Myles Garrett,Trey Hendrickson,T.J. Watt,Patrick Surtain II
12,2024 NFL Season Awards,Which team did Patrick Surtain II play for in 2024?,Denver Broncos,Dallas Cowboys,Pittsburgh Steelers,Kansas City Chiefs,Denver Broncos
13,2024 NFL Season Awards,Who won the 2024 Offensive Rookie of the Year award?,Jayden Daniels,Brock Bowers,Xavier Worthy,Marvin Harrison Jr.,Jayden Daniels
14,2024 NFL Season Awards,Who won the 2024 Defensive Rookie of the Year award?,Jared Verse,Quinyon Mitchell,Braden Fiske,Chop Robinson,Jared Verse
15,2024 NFL Season Awards,How many rushing yards did Saquon Barkley have in the 2024 regular season?,"2,005","1,905","2,105","1,850","2,005"
16,2024 NFL Season Awards,In which city was the 2025 NFL Honors ceremony held?,New Orleans,Las Vegas,Phoenix,Tampa,New Orleans
17,2024 NFL Season Awards,Who was the host of the 2025 NFL Honors ceremony?,Snoop Dogg,Ice-T,LL Cool J,Common,Snoop Dogg
18,Saquon Barkley Records,How many rushing yards did Saquon Barkley have in Week 12 against the Los Angeles Rams?,255,205,245,225,255
19,Saquon Barkley Records,Which Eagles player's single-season rushing record did Saquon Barkley break?,LeSean McCoy,Brian Westbrook,Duce Staley,Wilbert Montgomery,LeSean McCoy
20,Saquon Barkley Records,In what year did LeSean McCoy set the previous Eagles rushing record?,2013,2012,2014,2011,2013
21,Saquon Barkley Records,"How many yards were Saquon Barkley's 255 rushing yards in Week 12, the __-most in NFL history?",9th,8th,10th,7th,9th
22,Saquon Barkley Records,Against which team did Barkley rush for 205 yards in the 2024 divisional playoff game?,Los Angeles Rams,Green Bay Packers,Detroit Lions,San Francisco 49ers,Los Angeles Rams
23,Saquon Barkley Records,"In Week 13, against which team did Barkley break the Eagles single-season rushing record?",Baltimore Ravens,Pittsburgh Steelers,Dallas Cowboys,New York Giants,Baltimore Ravens
24,Saquon Barkley Records,How many total yards did Barkley have when he rushed for 255 yards against the Rams in Week 12?,302,280,310,295,302
25,Saquon Barkley Records,"In the Wild Card playoff game, how many rushing yards did Barkley have against the Packers?",119,125,110,135,119
26,Saquon Barkley Records,How many rushing yards did Barkley accumulate in his first Eagles game?,109,99,120,115,109
27,Quarterbacks 2024,How many passing yards did Lamar Jackson throw for in the 2024 season?,"4,172","4,000","4,200","3,950","4,172"
28,Quarterbacks 2024,How many rushing yards did Lamar Jackson have in the 2024 season?,915,850,900,950,915
29,Quarterbacks 2024,How many passing touchdowns did Jalen Hurts throw in the 2024 regular season?,18,20,16,22,18
30,Quarterbacks 2024,What was Jalen Hurts' passer rating in the 2024 season?,103.7,101.5,105.0,102.3,103.7
31,Quarterbacks 2024,How many passing yards did Jalen Hurts have in Super Bowl LIX?,221,240,200,210,221
32,Quarterbacks 2024,How many rushing yards did Jalen Hurts have in Super Bowl LIX?,72,60,85,50,72
33,Quarterbacks 2024,How many games did Jalen Hurts play in the 2024 regular season?,15,16,14,17,15
34,Quarterbacks 2024,What was the completion percentage for Jalen Hurts in 2024?,68.7%,70.5%,66.2%,72.1%,68.7%
35,2024 NFL Draft,Which team selected Cam Ward with the 1st overall pick in the 2025 NFL Draft?,Tennessee Titans,Jacksonville Jaguars,Las Vegas Raiders,Cleveland Browns,Tennessee Titans
36,2024 NFL Draft,What college did Cam Ward attend?,Miami,Oklahoma,Texas,Florida State,Miami
37,2024 NFL Draft,Which team traded up to the 2nd pick to select Travis Hunter?,Jacksonville Jaguars,Cleveland Browns,Las Vegas Raiders,Arizona Cardinals,Jacksonville Jaguars
38,2024 NFL Draft,What position did Travis Hunter play?,Cornerback,Safety,Wide Receiver,Linebacker,Cornerback
39,2024 NFL Draft,Which college did Travis Hunter attend?,Colorado,Alabama,Georgia,LSU,Colorado
40,2024 NFL Draft,Who won the 2024 draft in the first round?,Chicago Bears,Los Angeles Rams,Dallas Cowboys,Kansas City Chiefs,Chicago Bears
41,2024 NFL Draft,Which QB was selected first overall in the 2024 draft by the Chicago Bears?,Caleb Williams,Jayden Daniels,Drake Maye,Michael Penix Jr.,Caleb Williams
42,2024 NFL Draft,Who was the Defensive Rookie of the Year?,Jared Verse,Quinyon Mitchell,Braden Fiske,Chop Robinson,Jared Verse
43,2024 NFL Draft,How many pressures did Jared Verse record in his rookie season?,77,70,85,65,77
44,2024 Regular Season,What was the Kansas City Chiefs' record in the 2024 regular season?,15-1,14-2,13-3,14-3,15-1
45,2024 Regular Season,Which team won the NFC North in 2024?,Minnesota Vikings,Detroit Lions,Chicago Bears,Green Bay Packers,Minnesota Vikings
46,2024 Regular Season,What was the Minnesota Vikings' record in 2024?,14-2,13-3,15-1,12-4,14-2
47,2024 Regular Season,Which team won the NFC East in 2024?,Philadelphia Eagles,Dallas Cowboys,Washington Commanders,New York Giants,Philadelphia Eagles
48,2024 Regular Season,What was the Philadelphia Eagles' record in the 2024 regular season?,13-3,14-2,12-4,11-5,13-3
49,2024 Regular Season,Which division had the most wins in 2024?,NFC North,AFC West,AFC North,NFC East,NFC North
50,2024 Regular Season,How many total wins did the NFC North have in 2024?,45,43,40,48,45
51,2024 Regular Season,Which team won the AFC South in 2024?,Houston Texans,Jacksonville Jaguars,Indianapolis Colts,Tennessee Titans,Houston Texans
52,2024 Regular Season,Which team won the NFC West in 2024?,Los Angeles Rams,San Francisco 49ers,Seattle Seahawks,Arizona Cardinals,Los Angeles Rams
53,Receiving Leaders 2024,How many receiving yards did Tyreek Hill have in 2024?,"1,799","1,650","1,900","1,750","1,799"
54,Receiving Leaders 2024,For which team did Tyreek Hill play in 2024?,Miami Dolphins,Kansas City Chiefs,Buffalo Bills,Los Angeles Chargers,Miami Dolphins
55,Receiving Leaders 2024,How many catches did Travis Kelce have in 2024?,97,85,105,110,97
56,Receiving Leaders 2024,How many receiving yards did Travis Kelce have in 2024?,823,900,950,750,823
57,Receiving Leaders 2024,What was CeeDee Lamb's receiving yardage in 2024?,"1,194","1,100","1,300","1,050","1,194"
58,Receiving Leaders 2024,How many games did CeeDee Lamb play in 2024?,15,16,14,17,15
59,Receiving Leaders 2024,How many catches did Wan'Dale Robinson have in 2024?,93,85,105,110,93
60,Receiving Leaders 2024,How many receiving yards did Wan'Dale Robinson have in 2024?,699,650,750,800,699
61,Receiving Leaders 2024,What is CeeDee Lamb's current career receiving yardage through 2024?,"7,204","7,000","7,500","6,800","7,204"
62,Head Coaching Changes 2025,Who became the new head coach of the Dallas Cowboys in 2025?,Brian Schottenheimer,Pete Carroll,Aaron Glenn,Mike Vrabel,Brian Schottenheimer
63,Head Coaching Changes 2025,Who became the new head coach of the Las Vegas Raiders in 2025?,Pete Carroll,Brian Schottenheimer,Liam Coen,Aaron Glenn,Pete Carroll
64,Head Coaching Changes 2025,What is Pete Carroll's age?,73,71,75,69,73
65,Head Coaching Changes 2025,Who became the new head coach of the Jacksonville Jaguars in 2025?,Liam Coen,Aaron Glenn,Ben Johnson,Mike Vrabel,Liam Coen
66,Head Coaching Changes 2025,Who became the new head coach of the New York Jets in 2025?,Aaron Glenn,Ben Johnson,Mike Vrabel,Brian Schottenheimer,Aaron Glenn
67,Head Coaching Changes 2025,Who became the new head coach of the New England Patriots in 2025?,Mike Vrabel,Ben Johnson,Aaron Glenn,Liam Coen,Mike Vrabel
68,Head Coaching Changes 2025,Who became the new head coach of the Chicago Bears in 2025?,Ben Johnson,Mike Vrabel,Aaron Glenn,Liam Coen,Ben Johnson
69,Head Coaching Changes 2025,Who became the new head coach of the New Orleans Saints in 2025?,Kellen Moore,Brian Schottenheimer,Pete Carroll,Aaron Glenn,Kellen Moore
70,Head Coaching Changes 2025,When was Kellen Moore hired as Saints head coach?,"February 11, 2025","February 9, 2025","February 15, 2025","February 1, 2025","February 11, 2025"
71,Head Coaching Changes 2025,What was Kellen Moore's position before becoming Saints head coach?,Eagles offensive coordinator,49ers offensive coordinator,Chiefs offensive coordinator,Cowboys offensive coordinator,Eagles offensive coordinator
72,NFL Records & History,How many Super Bowls did Tom Brady appear in?,10,9,11,8,10
73,NFL Records & History,What is the all-time career passing yards record holder?,Tom Brady,Peyton Manning,Brett Favre,Dan Marino,Tom Brady
74,NFL Records & History,How many career passing yards does Peyton Manning have (most for a Hall of Famer)?,"71,940","71,000","72,500","70,500","71,940"
75,NFL Records & History,How many career passing yards does Brett Favre have?,"71,838","71,000","72,000","70,500","71,838"
76,NFL Records & History,Who holds the all-time career rushing yards record?,Barry Sanders,Walter Payton,Emmitt Smith,Jim Brown,Barry Sanders
77,NFL Records & History,How many career rushing yards does Barry Sanders have?,"15,269","16,726","14,580","15,000","15,269"
78,NFL Records & History,Who holds the single-season rushing yards record?,Eric Dickerson,Barry Sanders,Terrell Davis,Saquon Barkley,Eric Dickerson
79,NFL Records & History,How many rushing yards did Eric Dickerson have in his record season?,"2,105","2,000","2,150","1,950","2,105"
80,Sack Records,Who holds the all-time career sacks record?,Bruce Smith,Reggie White,Kevin Greene,Michael Strahan,Bruce Smith
81,Sack Records,How many career sacks does Bruce Smith have?,200,198,160,141.5,200
82,Sack Records,How many career sacks does Reggie White have?,198,200,160,150.5,198
83,Sack Records,Who holds the single-season sacks record?,Michael Strahan,T.J. Watt,Jared Allen,Mark Gastineau,Michael Strahan
84,Sack Records,How many sacks did Michael Strahan record in his record season?,22.5,22,21,23,22.5
85,Sack Records,In what year did Michael Strahan set the single-season sacks record?,2001,2003,2000,2002,2001
86,Sack Records,What team was Michael Strahan playing for when he set the sacks record?,New York Giants,Washington Commanders,Philadelphia Eagles,Dallas Cowboys,New York Giants
87,Sack Records,Who also holds the single-season sacks record with 22.5 sacks?,T.J. Watt,Jared Allen,Mark Gastineau,Chris Doleman,T.J. Watt
88,Sack Records,In what year did T.J. Watt tie the single-season sacks record?,2021,2020,2022,2019,2021
89,Sack Records,How many career sacks does Michael Strahan have?,141.5,150.5,160,159.5,141.5
90,Super Bowl Winners,Which team has won the most Super Bowls?,New England Patriots,Pittsburgh Steelers,Dallas Cowboys,San Francisco 49ers,New England Patriots
91,Super Bowl Winners,Which team won the most Super Bowls in the 1970s?,Pittsburgh Steelers,Dallas Cowboys,Miami Dolphins,Oakland Raiders,Pittsburgh Steelers
92,Super Bowl Winners,Which team won the most Super Bowls in the 1980s?,San Francisco 49ers,Dallas Cowboys,Washington Commanders,Miami Dolphins,San Francisco 49ers
93,Hall of Fame Quarterbacks,How many Hall of Fame quarterbacks are there?,26+,20,15,30,26+
94,Hall of Fame Quarterbacks,Who holds the most NFL MVP awards?,Peyton Manning,Tom Brady,Aaron Rodgers,Joe Montana,Peyton Manning
95,Hall of Fame Quarterbacks,Which QB was inducted into the Hall of Fame in 2016?,Brett Favre,Dan Marino,John Elway,Joe Montana,Brett Favre
96,Hall of Fame Quarterbacks,Which QB was inducted into the Hall of Fame in 2005?,Dan Marino,John Elway,Joe Montana,Steve Young,Dan Marino
97,Hall of Fame Quarterbacks,How many career passing yards did Joe Montana have?,"40,551","45,000","38,000","42,000","40,551"
98,Hall of Fame Quarterbacks,How many career passing yards did John Elway have?,"51,475","50,000","52,000","49,000","51,475"
99,Hall of Fame Quarterbacks,How many career passing yards did Dan Marino have?,"61,361","60,000","62,000","59,000","61,361"
100,2024 Season Leaders,Who led the NFL in passing yards in 2024?,Josh Allen,Lamar Jackson,Patrick Mahomes,Jalen Hurts,Josh Allen
101,2024 Season Leaders,Who led the NFL in passing touchdowns in 2024?,Patrick Mahomes,Josh Allen,Lamar Jackson,Jalen Hurts,Patrick Mahomes
102,2024 Season Leaders,Who led the NFL in rushing yards in 2024?,Saquon Barkley,Derrick Henry,Josh Jacobs,Jonathan Taylor,Saquon Barkley
103,2024 Season Leaders,Who led the NFL in receiving yards in 2024?,Tyreek Hill,Travis Kelce,CeeDee Lamb,A.J. Brown,Tyreek Hill
104,2024 Season Leaders,Who led the NFL in receptions in 2024?,Travis Kelce,Brock Bowers,Tyreek Hill,DeVonta Smith,Brock Bowers
105,2024 Season Leaders,How many receptions did Brock Bowers have in 2024 as a rookie?,112,110,115,105,112
106,2024 Season Leaders,How many rushing touchdowns did Saquon Barkley have in 2024?,13,11,15,10,13
107,2024 Season Leaders,How many receiving touchdowns did Tyreek Hill have in 2024?,13,11,15,10,13
108,Defensive Players 2024,How many passes defended did Patrick Surtain II have in 2024?,11,10,12,9,11
109,Defensive Players 2024,How many sacks did Trey Hendrickson have in 2024?,17.5,16,18.5,15,17.5
110,Defensive Players 2024,How many sacks did Myles Garrett have in 2024?,14,13,15,12,14
111,Defensive Players 2024,How many sacks did T.J. Watt have in 2024?,11.5,10,12.5,9,11.5
112,Defensive Players 2024,Which defensive lineman led the 2024 NFL in sacks?,Trey Hendrickson,Myles Garrett,T.J. Watt,Aaron Donald,Trey Hendrickson
113,Defensive Players 2024,How many tackles did Roquan Smith have in 2024?,132,125,140,120,132
114,Defensive Players 2024,How many pressures did Jared Verse record in 2024?,77,70,85,65,77
115,Defensive Players 2024,What position does Jared Verse play?,Edge Rusher,Linebacker,Safety,Cornerback,Edge Rusher
116,Recent Trades & Signings,Which team did Saquon Barkley sign with before the 2024 season?,Philadelphia Eagles,New York Giants,Pittsburgh Steelers,Dallas Cowboys,Philadelphia Eagles
117,Recent Trades & Signings,Who won the NFL Honors as Coach of the Year in 2025?,Kevin O'Connell,Jonathan Gannon,Jim Harbaugh,Dan Campbell,Kevin O'Connell
118,Recent Trades & Signings,What team does Kevin O'Connell coach?,Minnesota Vikings,Detroit Lions,Philadelphia Eagles,New York Giants,Minnesota Vikings
119,Recent Trades & Signings,Who did the Buffalo Bills sign to strengthen their cornerback position in 2025?,Nate Hobbs,D.J. Reed,Adoree' Jackson,Donte Jackson,Nate Hobbs
120,Recent Trades & Signings,What was the value of Nate Hobbs' contract with the Packers?,$48 million,$45 million,$50 million,$42 million,$48 million
121,Recent Trades & Signings,Who signed with the Kansas City Chiefs as a free agent in 2025?,Hollywood Brown,JuJu Smith-Schuster,Kareem Hunt,Charles Omenihu,Hollywood Brown
122,Recent Trades & Signings,What was the value of Hollywood Brown's contract with the Chiefs?,$11 million,$10 million,$12 million,$9 million,$11 million
123,Team Records & Standings,How many teams won 10 or more games in 2024?,14,13,15,12,14
124,Team Records & Standings,What is the minimum wins for playoff qualification in 2024?,10,9,11,8,10
125,Team Records & Standings,What was the Cincinnati Bengals' record in 2024?,6-8,8-8,7-9,5-11,8-8
126,Team Records & Standings,What was the Chicago Bears' record in 2024?,5-12,4-13,6-11,3-14,5-12
127,Team Records & Standings,How many teams made the 2024 NFL playoffs?,14,12,16,18,14
128,Team Records & Standings,Which conference had one more playoff team in 2024?,NFC,AFC,Equal,Neither,NFC
129,Team Records & Standings,When was the last time all playoff teams won at least 10 games before 2024?,2012,2010,2014,2008,2012
130,Playoff Matchups & Results,Which team earned the #1 seed in the AFC?,Kansas City Chiefs,Buffalo Bills,Baltimore Ravens,Pittsburgh Steelers,Kansas City Chiefs
131,Playoff Matchups & Results,Which team earned the #1 seed in the NFC?,Detroit Lions,Philadelphia Eagles,Minnesota Vikings,Los Angeles Rams,Detroit Lions
132,Playoff Matchups & Results,What was the Detroit Lions' record in 2024?,14-2,13-3,15-1,12-4,14-2
133,Playoff Matchups & Results,Which team earned the #2 seed in the AFC?,Buffalo Bills,Baltimore Ravens,Pittsburgh Steelers,Houston Texans,Buffalo Bills
134,Playoff Matchups & Results,Which team earned the #2 seed in the NFC?,Philadelphia Eagles,Detroit Lions,Minnesota Vikings,Los Angeles Rams,Philadelphia Eagles
135,Playoff Matchups & Results,Who did the Kansas City Chiefs face in the AFC Divisional round?,Houston Texans,Baltimore Ravens,Buffalo Bills,Pittsburgh Steelers,Houston Texans
136,Playoff Matchups & Results,What was the score of the Chiefs vs. Texans divisional playoff game?,"Chiefs 23, Texans 14","Chiefs 20, Texans 17","Chiefs 25, Texans 15","Chiefs 19, Texans 12","Chiefs 23, Texans 14"
137,Playoff Matchups & Results,Who did the Buffalo Bills beat in the AFC Divisional round?,Baltimore Ravens,Pittsburgh Steelers,Houston Texans,Denver Broncos,Baltimore Ravens
138,Playoff Matchups & Results,What was the score of the Bills vs. Ravens divisional playoff game?,"Bills 27, Ravens 25","Bills 25, Ravens 22","Bills 28, Ravens 26","Bills 24, Ravens 23","Bills 27, Ravens 25"
139,Playoff Matchups & Results,Who did the Philadelphia Eagles face in the NFC Wild Card round?,Green Bay Packers,Detroit Lions,San Francisco 49ers,Los Angeles Rams,Green Bay Packers
140,Rookie Standouts 2024,What college did Jayden Daniels attend?,LSU,Ohio State,Alabama,Georgia,LSU
141,Rookie Standouts 2024,How many rushing yards did Jayden Daniels have in his rookie season?,915,800,"1,000",750,915
142,Rookie Standouts 2024,What was Jayden Daniels' completion rate in 2024?,79.1%,77.5%,81.0%,75.2%,79.1%
143,Rookie Standouts 2024,Which college did Brock Bowers attend?,Nevada,Oregon,Colorado,Utah,Nevada
144,Rookie Standouts 2024,How many all-time rookie receptions did Brock Bowers set?,112,115,110,120,112
145,Rookie Standouts 2024,How many receiving yards did Brock Bowers have in 2024?,"1,194","1,100","1,300","1,050","1,194"
146,Rookie Standouts 2024,What college did Jared Verse attend?,Penn State,Alabama,Georgia,LSU,Penn State
147,Rookie Standouts 2024,How many pressures did Jared Verse have in the second half of 2024?,48,40,55,45,48
148,Rookie Standouts 2024,How old was Jared Verse when he turned 22 during the 2024 season?,Recently turned,Already 22,Will turn 22,About to turn,Recently turned
149,Team Achievements 2024,Against which team did the Eagles get their 8th consecutive win?,Baltimore Ravens,Pittsburgh Steelers,Washington Commanders,Dallas Cowboys,Baltimore Ravens
150,Team Achievements 2024,When was the last time the Rams and Chargers both made the playoffs?,2018,2016,2020,2022,2018
151,Team Achievements 2024,In which year did the NFL expand the playoff format to 14 teams?,2020,2021,2019,2022,2020
152,Historical Comparisons,How many total passes did Tom Brady throw in his career?,"13,089","12,000","14,000","11,500","13,089"
153,Historical Comparisons,How many playoff games did Tom Brady win?,35,30,40,32,35
154,Historical Comparisons,How many Super Bowl touchdowns did Tom Brady throw?,21,20,23,19,21
155,Historical Comparisons,How many Super Bowl touchdown passes does Patrick Mahomes have?,10,9,11,8,10
156,Historical Comparisons,What was Mahomes' Super Bowl LIX passer rating in the first half?,33 passing yards,Low score,Mixed performance,Struggled,33 passing yards
157,Quarterbacks Head to Head,How many career playoff wins does Patrick Mahomes have?,26,25,27,24,26
158,Quarterbacks Head to Head,How many career playoff games has Josh Allen played?,25+,20,30,15,25+
159,Quarterbacks Head to Head,Who has won more playoff games against the other: Allen or Mahomes?,Mahomes,Allen,Tied,Recently flipped,Mahomes
160,Quarterbacks Head to Head,How many passing yards did Josh Allen have in the 2024 regular season?,"3,731","3,500","3,900","3,600","3,731"
161,Quarterbacks Head to Head,How many rushing yards did Josh Allen have in 2024?,531,500,600,450,531
162,Quarterbacks Head to Head,How many passing touchdowns did Josh Allen have in 2024?,28,25,30,22,28
163,Quarterbacks Head to Head,How many playoff games has Lamar Jackson played?,16+,15,20,10,16+
164,Recent Player Transactions,Which team did Davante Adams play for before the trade?,Las Vegas Raiders,Kansas City Chiefs,Dallas Cowboys,New York Jets,Las Vegas Raiders
165,Recent Player Transactions,Did Davante Adams sign with the Jets or Chiefs?,Jets,Chiefs,Packers,Raiders stayed,Jets
166,Recent Player Transactions,How many defensive tackles have played in the 2024 draft class?,Multiple,Few,One,Several,Multiple
167,Recent Player Transactions,What college did Quinyon Mitchell attend?,Toledo,Ohio,Buffalo,Army,Toledo
168,Season Performance Metrics,How many total passing yards did Patrick Mahomes have in 2024?,"4,694","4,500","4,800","4,600","4,694"
169,Season Performance Metrics,How many passing touchdowns did Patrick Mahomes have in 2024?,27,25,30,28,27
170,Season Performance Metrics,What was Patrick Mahomes' passer rating in 2024?,102.5,100.0,105.0,99.5,102.5
171,Season Performance Metrics,How many total touchdowns did Saquon Barkley have in 2024?,13,14,15,12,13
172,Season Performance Metrics,What was Lamar Jackson's passer rating in 2024?,117.0,115.0,119.0,120.5,117.0
173,Season Performance Metrics,How many passing touchdowns did Lamar Jackson have in 2024?,41,40,42,39,41
174,Advanced Statistics,What position are the most times MVP awarded to?,Quarterback,Running Back,Wide Receiver,Linebacker,Quarterback
175,Advanced Statistics,How many consecutive years has a QB won the MVP award?,12,10,15,8,12
176,Advanced Statistics,What position was Alan Page when he won MVP in 1971?,Defensive Tackle,Linebacker,Safety,Cornerback,Defensive Tackle
177,Advanced Statistics,Who was the only other player to win MVP as a defensive player?,Lawrence Taylor,Joe Greene,Reggie White,Bruce Smith,Lawrence Taylor
178,Advanced Statistics,In what year did Lawrence Taylor win MVP?,1986,1985,1987,1988,1986
179,Advanced Statistics,In what years did Aaron Rodgers win MVP?,"2011, 2014, 2020, 2021","2010, 2013, 2019, 2020","2012, 2015, 2021, 2022",Others,"2011, 2014, 2020, 2021"
180,Advanced Statistics,How many Turnovers Worthy Play rate did Jayden Daniels have?,1.7%,1.5%,2.0%,2.5%,1.7%
181,Advanced Statistics,What was the primary reason the Eagles won Super Bowl LIX?,Dominant Defense,Strong Offense,Good Coaching,Luck,Dominant Defense
182,Game Statistics,How many first downs did the Eagles force the Chiefs to get in Super Bowl LIX?,12,15,10,14,12
183,Game Statistics,How many total yards did the Chiefs have in the first half of Super Bowl LIX?,23,30,50,15,23
184,Game Statistics,How many net passing yards did the Chiefs have in the first half?,20,33,50,15,20
185,Game Statistics,How many sacks did Josh Sweat have in Super Bowl LIX?,2.5,2,3,1.5,2.5
186,Game Statistics,How many passes did Jalen Hurts complete in Super Bowl LIX?,17,15,20,18,17
187,Team Victories & Streaks,How long was the Eagles' winning streak in 2024?,8 games,7 games,9 games,6 games,8 games
188,Team Victories & Streaks,Who broke the Eagles' winning streak?,Washington Commanders,Dallas Cowboys,Pittsburgh Steelers,New York Giants,Washington Commanders
189,Team Victories & Streaks,Which team won more playoff games: Chiefs or Bills?,Chiefs,Bills,Tied,Eagles,Chiefs
190,Player Contracts & Deals,Who was the franchise tag for the Kansas City Chiefs in 2025?,Trey Smith,Travis Kelce,Patrick Mahomes,Hollywood Brown,Trey Smith
191,Player Contracts & Deals,Who won the most expensive defensive contract in 2025?,Aaron Banks,Nate Hobbs,D.J. Reed,Others,Aaron Banks
192,Player Contracts & Deals,What was the value of Aaron Banks' contract?,$77 million,$75 million,$80 million,$70 million,$77 million
193,Player Contracts & Deals,What was the value of D.J. Reed's contract?,$48 million,$45 million,$50 million,$40 million,$48 million
194,Notable Performances,How many receiving yards did Marvin Harrison Jr. have in 2024?,993,900,"1,050",850,993
195,Notable Performances,How many receiving yards did Brian Thomas Jr. have in 2024?,"1,282","1,100","1,400","1,000","1,282"
196,Notable Performances,How many receiving touchdowns did Brian Thomas Jr. have in 2024?,10,8,12,6,10
