ID,Category,Question,Option A,Option B,Option C,Option D,Correct Answer
404,Conference Winners 2020-2023,Which team won the NFC East in 2020?,Washington Football Team,Philadelphia Eagles,Dallas Cowboys,New York Giants,Washington Football Team
405,Conference Winners 2020-2023,Which team won the NFC West in 2020?,Seattle Seahawks,San Francisco 49ers,Los Angeles Rams,Arizona Cardinals,Seattle Seahawks
406,Conference Winners 2020-2023,Which team won the AFC East in 2021?,Buffalo Bills,New England Patriots,Miami Dolphins,New York Jets,Buffalo Bills
407,Conference Winners 2020-2023,Which team won the NFC East in 2021?,Dallas Cowboys,Washington Football Team,Philadelphia Eagles,New York Giants,Dallas Cowboys
408,Conference Winners 2020-2023,Which team won the AFC West in 2022?,Kansas City Chiefs,Los Angeles Chargers,Las Vegas Raiders,Denver Broncos,Kansas City Chiefs
409,Conference Winners 2020-2023,Which team won the NFC South in 2023?,Tampa Bay Buccaneers,New Orleans Saints,Atlanta Falcons,Carolina Panthers,Tampa Bay Buccaneers
410,Conference Winners 2020-2023,Which team won the AFC South in 2023?,Houston Texans,Indianapolis Colts,Jacksonville Jaguars,Tennessee Titans,Houston Texans
411,Conference Winners 2020-2023,Which team won the NFC North in 2023?,Detroit Lions,Minnesota Vikings,Green Bay Packers,Chicago Bears,Detroit Lions
412,Free Agency & Trades 2020-2023,In what year did Tom Brady sign with Tampa Bay?,2020,2019,2021,2018,2020
413,Free Agency & Trades 2020-2023,Which team did Matthew Stafford get traded to?,Los Angeles Rams,Detroit Lions,Miami Dolphins,Buffalo Bills,Los Angeles Rams
414,Free Agency & Trades 2020-2023,In what year was Matthew Stafford traded?,2021,2020,2022,2019,2021
415,Free Agency & Trades 2020-2023,In what year was Christian McCaffrey traded mid-season?,2022,2021,2023,2020,2022
416,Hall of Fame & Awards 2020-2023,In what year was Peyton Manning inducted?,2023,2022,2024,2021,2023
417,Hall of Fame & Awards 2020-2023,How many Pro Bowls did Peyton Manning make?,14,13,15,12,14
418,Hall of Fame & Awards 2020-2023,In what year was John Elway inducted?,2004,2005,2003,2002,2004
419,Hall of Fame & Awards 2020-2023,In what year was Dan Marino inducted?,2005,2004,2006,2003,2005
420,Offensive Legends 2020-2023,How many receiving yards did Travis Kelce have in 2020?,"1,229","1,100","1,350","1,000","1,229"
421,Offensive Legends 2020-2023,How many receiving touchdowns did Travis Kelce have in 2020?,11,10,13,9,11
422,Offensive Legends 2020-2023,How many receiving yards did Mike Evans have in 2020?,"1,006",950,"1,100",850,"1,006"
423,Offensive Legends 2020-2023,In what year did Gronkowski return?,2021,2020,2022,2023,2021
424,Offensive Legends 2020-2023,How many receiving touchdowns did Gronkowski have in 2021?,13,11,15,10,13
425,Running Backs 2020-2023,Who led the NFL in rushing yards in 2020?,Derrick Henry,Aaron Jones,Jonathan Taylor,Dalvin Cook,Derrick Henry
426,Running Backs 2020-2023,How many rushing yards did Derrick Henry have in 2020?,"1,540","1,400","1,650","1,300","1,540"
427,Running Backs 2020-2023,Who led the NFL in rushing yards in 2021?,Jonathan Taylor,Derrick Henry,Aaron Jones,Najee Harris,Jonathan Taylor
428,Running Backs 2020-2023,How many rushing yards did Jonathan Taylor have in 2021?,"1,811","1,700","1,900","1,600","1,811"
429,Running Backs 2020-2023,Who led the NFL in rushing yards in 2022?,Jeff Wilson Jr.,Christian McCaffrey,Nick Chubb,Aaron Jones,Jeff Wilson Jr.
430,Running Backs 2020-2023,How many rushing yards did Jeff Wilson Jr. have in 2022?,"1,025",950,"1,100",850,"1,025"
431,Running Backs 2020-2023,Which team did Derrick Henry play for?,Los Angeles Rams,Tennessee Titans,Pittsburgh Steelers,Dallas Cowboys,Los Angeles Rams
432,Defensive Backs 2020-2023,When was Sauce Gardner drafted?,2022,2021,2023,2020,2022
433,Defensive Backs 2020-2023,Which team drafted Sauce Gardner?,New York Jets,New York Giants,New England Patriots,Buffalo Bills,New York Jets
434,Defensive Backs 2020-2023,In what year was Darrelle Revis inducted?,2023,2022,2024,2021,2023
435,Defensive Line 2020-2023,When did Aaron Donald retire?,March 2024,February 2024,January 2024,April 2023,March 2024
436,Defensive Line 2020-2023,How many career sacks does Aaron Donald have?,111,100,120,95,111
437,Defensive Line 2020-2023,How many sacks did Chris Jones have in 2023?,10.5,9,12,8,10.5
438,Defensive Line 2020-2023,When did J.J. Watt retire?,2023,2022,2024,2021,2023
439,Defensive Line 2020-2023,How many career sacks does J.J. Watt have?,114.5,100,120,110,114.5
440,Linebackers 2020-2023,How many tackles did Bobby Wagner have in 2022?,169,150,180,140,169
441,Linebackers 2020-2023,How many tackles did Fred Warner have in 2023?,162,150,175,140,162
442,Linebackers 2020-2023,How many career sacks does Ryan Kerrigan have?,117.5,110,120,105,117.5
443,Special Teams & Kickers 2020-2023,How many field goals did Harrison Butker make in 2022?,33,30,35,28,33
444,Special Teams & Kickers 2020-2023,When did Justin Tucker retire?,2023,2022,2024,2021,2023
445,Special Teams & Kickers 2020-2023,How many career field goals did Justin Tucker make?,413,400,425,390,413
446,Special Teams & Kickers 2020-2023,How many field goals did Matt Gay make in 2022?,29,27,31,25,29
447,Special Teams & Kickers 2020-2023,How many field goals did Greg Joseph make in 2023?,34,32,36,30,34
448,Coaching Changes 2020-2023,Who replaced Bruce Arians?,Todd Bowles,Giff Smith,Byron Leftwich,Kellen Moore,Todd Bowles
449,Coaching Changes 2020-2023,In what year did Sean Payton become Broncos coach?,2023,2022,2024,2021,2023
450,Coaching Changes 2020-2023,In what year did Jim Harbaugh become Chargers coach?,2024,2023,2025,2022,2024
451,Team Turnarounds,What was the Houston Texans' record improvement?,From 3-14 to playoff,From 4-13 to 8-9,From 5-12 to 10-7,From 6-11 to 9-8,From 3-14 to playoff
452,Comebacks & Close Games,How many points behind were the Chiefs at one point?,10,14,7,20,10
453,Record Breaking Performances,What was Aaron Rodgers' TD to INT ratio in 2020?,48:5,45:5,50:5,40:5,48:5
454,Record Breaking Performances,How many receptions did Christian McCaffrey have in 2023?,80+,70+,90+,60+,80+
455,Notable Transactions & Signings,In what year did OBJ sign with the Rams?,2021,2020,2022,2023,2021
456,Quarterbacks 2024,"Who was the first QB to throw for 4,000+ yards and rush for 800+ yards?",Lamar Jackson,Dak Prescott,Patrick Surtain II,Joe Burrow,Lamar Jackson
457,2024 Season Leaders,Who set NFL rookie record?,Brock Bowers,Dak Prescott,Patrick Surtain II,Travis Kelce,Brock Bowers
458,Defensive Players 2024,Who finished in the top 5 for this category?,Jared Verse,Dak Prescott,Patrick Surtain II,Travis Kelce,Jared Verse
459,Team Achievements 2024,Which of these teams made the playoffs in 2024?,Detroit Lions,Cleveland Browns,Miami Dolphins,Pittsburgh Steelers,Detroit Lions
460,Team Achievements 2024,Which team won their first playoff game since 1991?,Detroit Lions,Denver Broncos,Carolina Panthers,Philadelphia Eagles,Detroit Lions
461,Team Achievements 2024,Which team beat the #2 seed Cowboys in the 2023 playoffs?,#7 seed Packers,Denver Broncos,Kansas City Chiefs,New York Giants,#7 seed Packers
462,Team Achievements 2024,Who was the first time a #7 seed won a playoff game since 2020?,this,Dak Prescott,Patrick Surtain II,Joe Burrow,this
463,Historical Comparisons,Which player lose Super Bowl LIX?,Mahomes,Dak Prescott,Patrick Surtain II,Travis Kelce,Mahomes
464,Recent Player Transactions,Which player got traded in 2024?,Davante Adams,Dak Prescott,Patrick Surtain II,Travis Kelce,Davante Adams
465,Recent Player Transactions,Which team acquire any cornerbacks in the 2024 draft?,Eagles acquire any cornerbacks in the 2024,Philadelphia Eagles,Los Angeles Chargers,Arizona Cardinals,Eagles acquire any cornerbacks in the 2024
466,Recent Player Transactions,Which player performed well in his rookie season with the Chiefs?,Xavier Worthy,Dak Prescott,Patrick Surtain II,Travis Kelce,Xavier Worthy
467,Recent Player Transactions,Which player had a strong rookie season in 2024?,Braden Fiske,Dak Prescott,Patrick Surtain II,Travis Kelce,Braden Fiske
468,Recent Player Transactions,Which team performed well?,any cornerbacks from the Eagles 2024,New Orleans Saints,New York Jets,Cincinnati Bengals,any cornerbacks from the Eagles 2024
469,Advanced Statistics,Who ranked in the top 6 for Turnovers Worthy Play rate?,Jayden Daniels,Dak Prescott,Patrick Surtain II,Joe Burrow,Jayden Daniels
470,Game Statistics,Who caused a fumble in Super Bowl LIX?,Milton Williams,Dak Prescott,Patrick Surtain II,Travis Kelce,Milton Williams
471,Team Victories & Streaks,Which team won streak in 2024?,Eagles,Detroit Lions,Cleveland Browns,Miami Dolphins,Eagles
472,Team Victories & Streaks,Which team City Chiefs have a long winning streak in 2024?,Kansas City Chiefs,New York Giants,Houston Texans,Chicago Bears,Kansas City Chiefs
473,Team Victories & Streaks,Which player division winners have at least 10 wins in 2024?,all division,Dak Prescott,Patrick Surtain II,Joe Burrow,all division
474,Team Victories & Streaks,Which team had a strong 2024 season?,Vikings,Jacksonville Jaguars,New York Jets,Indianapolis Colts,Vikings
475,Player Contracts & Deals,Which player signed a big contract in 2025?,D.J. Reed,Dak Prescott,Patrick Surtain II,Travis Kelce,D.J. Reed
476,Player Contracts & Deals,Which player signed with any AFC team in 2025?,Mekhi Becton,Dak Prescott,Patrick Surtain II,Joe Burrow,Mekhi Becton
477,Notable Performances,Which player had a strong first season with his new team?,Derrick Henry,Dak Prescott,Patrick Surtain II,Travis Kelce,Derrick Henry
478,Notable Performances,Which player had a strong rookie season?,Marvin Harrison Jr.,Dak Prescott,Patrick Surtain II,Joe Burrow,Marvin Harrison Jr.
479,Notable Performances,Which team performed well in 2024?,49ers,Pittsburgh Steelers,Tennessee Titans,Detroit Lions,49ers
480,Coaching Performance,Which team have issues with playoff success in 2024?,Ravens,Cincinnati Bengals,Kansas City Chiefs,Green Bay Packers,Ravens
481,Offensive Weapons,Which team have good offensive coaching in 2024?,Bills,Washington Commanders,New Orleans Saints,Tampa Bay Buccaneers,Bills
482,Defensive Excellence,Who caused turnovers in Super Bowl LIX?,Eagles,Las Vegas Raiders,Baltimore Ravens,Miami Dolphins,Eagles
483,Individual Records & Milestones,Which player Barkley break any team records in 2024?,Saquon Barkley,Dak Prescott,Patrick Surtain II,Joe Burrow,Saquon Barkley
484,Individual Records & Milestones,Which player Barkley come close to the NFL single-season rushing record?,Saquon Barkley come close to the NFL single-season,Dak Prescott,Patrick Surtain II,Travis Kelce,Saquon Barkley come close to the NFL single-season
485,Individual Records & Milestones,Who set the all-time rookie receptions record?,Brock Bowers,Dak Prescott,Patrick Surtain II,Joe Burrow,Brock Bowers
486,Individual Records & Milestones,Which player Daniels have a historic rookie season?,Jayden Daniels,Dak Prescott,Patrick Surtain II,Joe Burrow,Jayden Daniels
487,Fan Favorites & Highlights,Which player DeJean have a memorable moment in Super Bowl LIX?,Cooper DeJean,Dak Prescott,Patrick Surtain II,Travis Kelce,Cooper DeJean
488,Fan Favorites & Highlights,Which player Smith score in Super Bowl LIX?,DeVonta Smith,Dak Prescott,Patrick Surtain II,Joe Burrow,DeVonta Smith
489,Fan Favorites & Highlights,Which player had a strong 2024 season?,DeVonta Smith,Dak Prescott,Patrick Surtain II,Travis Kelce,DeVonta Smith
490,Fan Favorites & Highlights,Which team have a dominant passing game in 2024?,Eagles,Chicago Bears,Cleveland Browns,Denver Broncos,Eagles
491,2025 Offseason Moves,Which team make significant roster changes?,Ravens,Chicago Bears,New York Jets,Atlanta Falcons,Ravens
492,Conference Standings,Which player South have a weak 2024 season?,AFC South,Dak Prescott,Patrick Surtain II,Travis Kelce,AFC South
493,Special Teams & Other Stats,Who set the combined regular season + postseason rushing record?,Saquon Barkley,Dak Prescott,Patrick Surtain II,Travis Kelce,Saquon Barkley
494,Special Teams & Other Stats,Which team rest starters in their final regular season game?,Eagles rest,Houston Texans,Las Vegas Raiders,Dallas Cowboys,Eagles rest
495,Trivia & Fun Facts,Who won both a championship and Super Bowl?,Jalen Hurts become only the 3rd,Dak Prescott,Patrick Surtain II,Travis Kelce,Jalen Hurts become only the 3rd
496,Trivia & Fun Facts,Which player Hurts play in college?,Jalen Hurts,Dak Prescott,Patrick Surtain II,Joe Burrow,Jalen Hurts
497,Notable Draft Picks,Who won the Heisman Trophy?,Caleb Williams,Dak Prescott,Patrick Surtain II,Travis Kelce,Caleb Williams
498,Notable Draft Picks,Which player signed with the Falcons?,Michael Penix Jr.,Dak Prescott,Patrick Surtain II,Travis Kelce,Michael Penix Jr.
499,Playoff Seeding Analysis,Which team make the Super Bowl as the #1 seed?,Chiefs,Pittsburgh Steelers,Detroit Lions,Baltimore Ravens,Chiefs
500,Playoff Seeding Analysis,Which team make the Super Bowl as the #2 seed?,Eagles,Arizona Cardinals,Dallas Cowboys,Detroit Lions,Eagles
501,Injury & Health Updates,Which player Mahomes have any injuries in 2024?,Patrick Mahomes,Dak Prescott,Patrick Surtain II,Travis Kelce,Patrick Mahomes
502,Injury & Health Updates,Which team have a healthy roster in 2024?,Eagles,Las Vegas Raiders,Tennessee Titans,New England Patriots,Eagles
503,Injury & Health Updates,Which team have health issues in 2024?,Chiefs,Minnesota Vikings,Pittsburgh Steelers,Atlanta Falcons,Chiefs
504,Injury & Health Updates,Which team have major injuries in 2024?,Lions,Kansas City Chiefs,New Orleans Saints,Cincinnati Bengals,Lions
505,Fan Voting & Selections,Who won the Pro Bowl vote in 2024?,Josh Allen,Dak Prescott,Patrick Surtain II,Travis Kelce,Josh Allen
506,Fan Voting & Selections,Which player Mahomes make the Pro Bowl in 2024?,Patrick Mahomes,Dak Prescott,Patrick Surtain II,Joe Burrow,Patrick Mahomes
507,Fan Voting & Selections,Which player Jackson make the Pro Bowl in 2024?,Lamar Jackson,Dak Prescott,Patrick Surtain II,Joe Burrow,Lamar Jackson
508,Fan Voting & Selections,Which player Barkley make the Pro Bowl in 2024?,Saquon Barkley,Dak Prescott,Patrick Surtain II,Travis Kelce,Saquon Barkley
509,Fan Voting & Selections,Which player Kelce make the Pro Bowl in 2024?,Travis Kelce,Dak Prescott,Patrick Surtain II,Joe Burrow,Travis Kelce
510,Fan Voting & Selections,Which player Hill make the Pro Bowl in 2024?,Tyreek Hill,Dak Prescott,Patrick Surtain II,Travis Kelce,Tyreek Hill
511,Fan Voting & Selections,Which player Lamb make the Pro Bowl in 2024?,CeeDee Lamb,Dak Prescott,Patrick Surtain II,Travis Kelce,CeeDee Lamb
512,Fan Voting & Selections,Which player Surtain II make the Pro Bowl in 2024?,Patrick Surtain II,Dak Prescott,Travis Kelce,Joe Burrow,Patrick Surtain II
513,Fan Voting & Selections,Which player Hendrickson make the Pro Bowl in 2024?,Trey Hendrickson,Dak Prescott,Patrick Surtain II,Travis Kelce,Trey Hendrickson
514,Fan Voting & Selections,Which team have multiple Pro Bowlers?,Eagles,Minnesota Vikings,Detroit Lions,Kansas City Chiefs,Eagles
515,Franchise Records & Milestones,Which team won their second Super Bowl in franchise history?,Eagles,Los Angeles Chargers,Los Angeles Rams,Dallas Cowboys,Eagles
516,Franchise Records & Milestones,Which team make the Super Bowl in 2017?,Eagles,Green Bay Packers,New England Patriots,Indianapolis Colts,Eagles
517,Competitive Balance,Which player division have two teams with 12+ wins?,any division,Dak Prescott,Patrick Surtain II,Travis Kelce,any division
518,Competitive Balance,Which player playoff team exceed expectations?,any,Dak Prescott,Patrick Surtain II,Travis Kelce,any
519,Competitive Balance,Which player playoff team underperform?,any,Dak Prescott,Patrick Surtain II,Travis Kelce,any
520,Media & Broadcasting,Which player NFL season have strong viewership?,2024 NFL season,Dak Prescott,Patrick Surtain II,Joe Burrow,2024 NFL season
521,Youth & Rookie Development,Who won major awards besides Daniels?,any 2024 rookie,Dak Prescott,Patrick Surtain II,Joe Burrow,any 2024 rookie
522,Youth & Rookie Development,Which player 2024 QB recruit become an immediate starter?,any 2024 QB recruit become an immediate,Dak Prescott,Patrick Surtain II,Travis Kelce,any 2024 QB recruit become an immediate
523,Super Bowl LIV 2020,Who won both MVP and Super Bowl?,Patrick Mahomes become the youngest to,Dak Prescott,Patrick Surtain II,Joe Burrow,Patrick Mahomes become the youngest to
524,Super Bowl LV 2021,Which player Brady play for the Buccaneers in 2020?,Tom Brady,Dak Prescott,Patrick Surtain II,Travis Kelce,Tom Brady
525,Super Bowl LVI 2022,Which team won at their home stadium?,Rams,Buffalo Bills,Tennessee Titans,Carolina Panthers,Rams
526,Super Bowl LVI 2022,Which player Stafford get his first Super Bowl win?,Matthew Stafford,Dak Prescott,Patrick Surtain II,Travis Kelce,Matthew Stafford
527,Super Bowl LVII 2023,Which team won back-to-back Super Bowls?,Chiefs,Jacksonville Jaguars,Philadelphia Eagles,Buffalo Bills,Chiefs
528,Super Bowl LVIII 2024,Which player make the Chiefs the first back-to-back since 2004?,this,Dak Prescott,Patrick Surtain II,Joe Burrow,this
529,Super Bowl LVIII 2024,Which player McCaffrey score in Super Bowl LVIII?,Christian McCaffrey,Dak Prescott,Patrick Surtain II,Joe Burrow,Christian McCaffrey
530,2020 NFL Season,Which team won the NFC North in 2020?,Packers,Philadelphia Eagles,Jacksonville Jaguars,Houston Texans,Packers
531,2021 NFL Season,Which player Brady throw for 40+ touchdowns in 2021?,Tom Brady,Dak Prescott,Patrick Surtain II,Travis Kelce,Tom Brady
532,2021 NFL Season,Which player Brady break any records in 2021?,Tom Brady,Dak Prescott,Patrick Surtain II,Travis Kelce,Tom Brady
533,2022 NFL Season,Who won a Super Bowl MVP in 2022?,Patrick Mahomes,Dak Prescott,Patrick Surtain II,Travis Kelce,Patrick Mahomes
534,2023 NFL Season MVP,Who won unanimously in 2019?,Lamar Jackson,Dak Prescott,Patrick Surtain II,Joe Burrow,Lamar Jackson
535,2023 Season Awards,Which player McCaffrey have 17 consecutive games with a touchdown?,Christian McCaffrey,Dak Prescott,Patrick Surtain II,Travis Kelce,Christian McCaffrey
536,2023 Season Awards,Which player McCaffrey finish in top 5 MVP voting?,Christian McCaffrey,Dak Prescott,Patrick Surtain II,Travis Kelce,Christian McCaffrey
537,Patrick Mahomes Career,Which player Mahomes play baseball in college?,Patrick Mahomes,Dak Prescott,Patrick Surtain II,Joe Burrow,Patrick Mahomes
538,Christian McCaffrey Career,Which player McCaffrey play at Stanford?,Christian McCaffrey,Dak Prescott,Patrick Surtain II,Joe Burrow,Christian McCaffrey
539,2020-2023 Draft Highlights,Which player Anderson Jr. play defensive end?,Will Anderson Jr.,Dak Prescott,Patrick Surtain II,Joe Burrow,Will Anderson Jr.
540,Defensive Standouts 2020-2023,Which player Watt tie the single-season sacks record?,T.J. Watt tie the single-season,Dak Prescott,Patrick Surtain II,Travis Kelce,T.J. Watt tie the single-season
541,Notable Playoff Moments 2020-2023,Which team City Chiefs lose in the 2021 playoffs?,Kansas City Chiefs,Dallas Cowboys,Washington Commanders,New England Patriots,Kansas City Chiefs
542,Individual Milestone Records,Which player Brady break Peyton Manning's record?,Tom Brady,Dak Prescott,Patrick Surtain II,Joe Burrow,Tom Brady
543,Individual Milestone Records,Who set completion percentage record?,Aaron Rodgers,Dak Prescott,Patrick Surtain II,Joe Burrow,Aaron Rodgers
544,Free Agency & Trades 2020-2023,Which player signed with Tampa Bay in free agency?,Tom Brady,Dak Prescott,Patrick Surtain II,Joe Burrow,Tom Brady
545,Free Agency & Trades 2020-2023,Which player signed with Tampa Bay?,Rob Gronkowski also,Dak Prescott,Patrick Surtain II,Travis Kelce,Rob Gronkowski also
546,Free Agency & Trades 2020-2023,Which player signed with the Rams?,Odell Beckham Jr.,Dak Prescott,Patrick Surtain II,Travis Kelce,Odell Beckham Jr.
547,Free Agency & Trades 2020-2023,Which player signed with Miami as a free agent?,Tyreek Hill,Dak Prescott,Patrick Surtain II,Travis Kelce,Tyreek Hill
548,Hall of Fame & Awards 2020-2023,Which player Manning get inducted into the Hall of Fame?,Peyton Manning,Dak Prescott,Patrick Surtain II,Travis Kelce,Peyton Manning
549,Hall of Fame & Awards 2020-2023,Which player Elway get inducted into the Hall of Fame?,John Elway,Dak Prescott,Patrick Surtain II,Joe Burrow,John Elway
550,Offensive Legends 2020-2023,Which player had a strong 2020 season?,Robert Woods,Dak Prescott,Patrick Surtain II,Travis Kelce,Robert Woods
551,Offensive Legends 2020-2023,Which player Gronkowski return to play with Tampa Bay?,Rob Gronkowski,Dak Prescott,Patrick Surtain II,Travis Kelce,Rob Gronkowski
552,Running Backs 2020-2023,Which player Henry play for any other team besides Tennessee?,Derrick Henry,Dak Prescott,Patrick Surtain II,Joe Burrow,Derrick Henry
553,Defensive Backs 2020-2023,Which team Ramsey play for the Rams in 2020?,Jalen Ramsey,Arizona Cardinals,Baltimore Ravens,Jacksonville Jaguars,Jalen Ramsey
554,Defensive Backs 2020-2023,Which player had a strong rookie year?,Sauce Gardner,Dak Prescott,Patrick Surtain II,Joe Burrow,Sauce Gardner
555,Defensive Backs 2020-2023,Which player had a strong 2023 season?,Xavien Howard,Dak Prescott,Patrick Surtain II,Travis Kelce,Xavien Howard
556,Defensive Backs 2020-2023,Which player Revis get inducted into the Hall of Fame?,Darrelle Revis,Dak Prescott,Patrick Surtain II,Joe Burrow,Darrelle Revis
557,Linebackers 2020-2023,Which player Kerrigan play in 2020-2023?,Ryan Kerrigan,Dak Prescott,Patrick Surtain II,Joe Burrow,Ryan Kerrigan
558,Linebackers 2020-2023,Which player Kerrigan retire after 2023?,Ryan Kerrigan,Dak Prescott,Patrick Surtain II,Joe Burrow,Ryan Kerrigan
559,Special Teams & Kickers 2020-2023,Which player Tucker retire recently?,Justin Tucker,Dak Prescott,Patrick Surtain II,Travis Kelce,Justin Tucker
560,Special Teams & Kickers 2020-2023,Which player had a strong 2022 season?,Matt Gay,Dak Prescott,Patrick Surtain II,Travis Kelce,Matt Gay
561,Coaching Changes 2020-2023,Which player Arians retire?,Bruce Arians,Dak Prescott,Patrick Surtain II,Travis Kelce,Bruce Arians
562,Coaching Changes 2020-2023,Who won a Super Bowl?,Todd Bowles,Dak Prescott,Patrick Surtain II,Travis Kelce,Todd Bowles
563,Team Turnarounds,Which team Texans have a turnaround in 2023?,Houston Texans,Indianapolis Colts,Atlanta Falcons,Minnesota Vikings,Houston Texans
564,Team Turnarounds,Which team Jaguars have a turnaround in 2023?,Jacksonville Jaguars,Kansas City Chiefs,New England Patriots,New York Giants,Jacksonville Jaguars
565,Comebacks & Close Games,Which team have a comeback in Super Bowl LIV?,Chiefs,Chicago Bears,San Francisco 49ers,Arizona Cardinals,Chiefs
566,Comebacks & Close Games,Which team won Super Bowl LVI at home?,Rams,Houston Texans,Cleveland Browns,Indianapolis Colts,Rams
567,Comebacks & Close Games,Which team lead in Super Bowl LVII?,Eagles,Indianapolis Colts,Las Vegas Raiders,Denver Broncos,Eagles
568,Comebacks & Close Games,Which team lead in the 4th quarter of Super Bowl LVIII?,49ers,Jacksonville Jaguars,New England Patriots,Chicago Bears,49ers
569,Record Breaking Performances,Which player Rodgers break a TD-to-INT record in 2020?,Aaron Rodgers,Dak Prescott,Patrick Surtain II,Travis Kelce,Aaron Rodgers
570,Record Breaking Performances,Which player Brady break a passing yards record in 2021?,Tom Brady,Dak Prescott,Patrick Surtain II,Joe Burrow,Tom Brady
571,Record Breaking Performances,Which player McCaffrey break a receiving record for RBs?,Christian McCaffrey,Dak Prescott,Patrick Surtain II,Travis Kelce,Christian McCaffrey
572,Record Breaking Performances,Which player Hill break any records with Miami?,Tyreek Hill,Dak Prescott,Patrick Surtain II,Joe Burrow,Tyreek Hill
573,Record Breaking Performances,"Which player Adams have back-to-back 1,500+ yard seasons?",Davante Adams,Dak Prescott,Patrick Surtain II,Travis Kelce,Davante Adams
574,Record Breaking Performances,Which player Kupp have a historic season in 2021?,Cooper Kupp,Dak Prescott,Patrick Surtain II,Travis Kelce,Cooper Kupp
575,Record Breaking Performances,Which player Taylor break any rushing records in 2021?,Jonathan Taylor,Dak Prescott,Patrick Surtain II,Travis Kelce,Jonathan Taylor
576,Record Breaking Performances,"Which player Henry have 1,500+ rushing yards in 2020?",Derrick Henry,Dak Prescott,Patrick Surtain II,Joe Burrow,Derrick Henry
577,Playoff History 2020-2023,Which team won the NFC South in 2020?,Buccaneers,New York Jets,San Francisco 49ers,Pittsburgh Steelers,Buccaneers
578,Playoff History 2020-2023,Which team won the AFC North in 2021?,Steelers,Cleveland Browns,San Francisco 49ers,Arizona Cardinals,Steelers
579,Playoff History 2020-2023,Which team won the NFC East in 2022?,Eagles,Miami Dolphins,Carolina Panthers,Cleveland Browns,Eagles
580,Playoff History 2020-2023,Which team won the NFC West in 2023?,49ers,Dallas Cowboys,Philadelphia Eagles,Cincinnati Bengals,49ers
581,Performance Metrics 2020-2023,Which team Steelers have the top defense in 2020?,Pittsburgh Steelers,Tampa Bay Buccaneers,Atlanta Falcons,Arizona Cardinals,Pittsburgh Steelers
582,Performance Metrics 2020-2023,Which player team have both top offense and defense?,any team,Dak Prescott,Patrick Surtain II,Joe Burrow,any team
583,Injury-Impacted Seasons,Which player Carson miss significant time?,Chris Carson,Dak Prescott,Patrick Surtain II,Joe Burrow,Chris Carson
584,Injury-Impacted Seasons,Which player Mostert have injury issues?,Raheem Mostert,Dak Prescott,Patrick Surtain II,Joe Burrow,Raheem Mostert
585,Injury-Impacted Seasons,Which player Mitchell have injury problems?,Elijah Mitchell,Dak Prescott,Patrick Surtain II,Travis Kelce,Elijah Mitchell
